table_name,field_name,field_type,description,mapped_from_table,mapped_from_field,mapping_type,release_date,relationship_category,cardinality
userActivity,action,,"The action the user took such as a login, or a view or use of content (download, livesend, send by email, etc).",,,,roadmap,,
userActivity,actionType,,The type of action within the category that the user performed.  See the action reference for details.,,,,roadmap,,
userActivity,actionCategory,,"The category of the action such as View, Usage, Login, Logout, etc",,,,roadmap,,
userActivity,occurredAt,,The datetime when the event occurred,,,,roadmap,,
userActivity,userId,,The id of the user who performed the action,users,id,,roadmap,primary,N:1
userActivity,userUsername,,The username of the user who performed the action,,,,roadmap,,
userActivity,instanceName,,"The name given to the document before it was delivered.  Typically this is the name of the library content, except in cases of Livedocs with generated names or documents renamed in Workspace or cart before being delivered",,,,roadmap,,
userActivity,instanceFormat,,"The format of the delivered content (pptx, docx, pdf, etc.)",,,,roadmap,,
userActivity,isBoundDelivery,,Boolean indicating if the usage is the result of a bound delivery option,,,,roadmap,,
userActivity,totalPages,,"The number of pages of the delivered document.  Currently only provided for the Livesend action, but will be added for others in the future",,,,roadmap,,
userActivity,contentId,,"A global content id representing a physical asset in the platform (represents library content, workspace content, and generated livedocs)",contents,id,,roadmap,primary,N:1
userActivity,libraryContentId,,The id of the library content that was delivered even if the delivery was on a derived Workspace document,libraryContents,id,,roadmap,informational,N:1
userActivity,libraryContentVersionId,,The version id of the library content that was delivered even if the delivery was on a derived Workspace document,libraryContentVersions,id,,roadmap,informational,N:1
userActivity,workspaceContentId,,The id of the workspace content that was delivered,workspaceContents,id,,roadmap,informational,N:1
userActivity,workspaceContentVersionId,,The version id of the workspace content that was delivered,workspaceContentVersions,id,,roadmap,informational,N:1
userActivity,livesendLinkId,,The id of the livesend link that this document was included in,livesendLinks,id,,roadmap,informational,N:1
userActivity,livesendLinkContentId,,This is guaranteed unique in this table and can be treated as a primary key to join to and table that can be joined to livesendLinkContents,livesendLinkContents,id,,roadmap,primary,N:1
userActivity,generatedLivedocId,,The id of the generated livedoc that the activity took place on,generatedLivedocs,id,,roadmap,informational,N:1
userActivity,searchClickId,,The id of the search click that the content activity is derived from,searchClick,id,,roadmap,primary,N:1
userActivity,contentProfileId,,The id of the content profile this document was viewed or used in,contentProfiles,id,,roadmap,primary,N:1
userActivity,contentProfileName,,The name of the content profile this document was views or used in,,,,roadmap,,
userActivity,productArea,,"The area of the product (DocCenter, NewsCenter, Workspace, Home Page, Search, etc...) where the action was performed",,,,roadmap,,
userActivity,application,,"The application (Web, iOS, Android, Outlook, Gmail Salesforce, Dynamics, etc) where the action was performed",,,,roadmap,,
contentUsageHistory,id,,The primary id for events in this table,,,,prod,,
contentUsageHistory,action,,"The usage/delivery action such as Download, Livesend, Send by Email, Add to Workspace, etc.",,,,prod,,
contentUsageHistory,actionType,,An indicator if the delivery option is 'Built-In' as part of Seismic or is a 'Custom' delivery option,,,,prod,,
contentUsageHistory,occurredAt,,The datetime when the event occurred,,,,prod,,
contentUsageHistory,userId,,The id of the user who performed the action,users,id,,prod,primary,N:1
contentUsageHistory,userUsername,,The username of the user who performed the action,,,,tbd - materialize,,
contentUsageHistory,instanceName,,"The name given to the document before it was delivered.  Typically this is the name of the library content, except in cases of Livedocs with generated names or documents renamed in Workspace or cart before being delivered",,,,prod,,
contentUsageHistory,instanceFormat,,"The format of the delivered content (pptx, docx, pdf, etc.)",,,,prod,,
contentUsageHistory,isBoundDelivery,,Boolean indicating if the usage is the result of a bound delivery option,,,,prod,,
contentUsageHistory,totalPages,,"The number of pages of the delivered document.  Currently only provided for the Livesend action, but will be added for others in the future",,,,prod,,
contentUsageHistory,contentId,,,,,,roadmap,primary,N:1
contentUsageHistory,libraryContentId,,The id of the library content that was delivered even if the delivery was on a derived Workspace document,libraryContents,id,,prod,informational,N:1
contentUsageHistory,libraryContentVersionId,,The version id of the library content that was delivered even if the delivery was on a derived Workspace document,libraryContentVersions,id,,tbd,informational,N:1
contentUsageHistory,workspaceContentId,,The id of the workspace content that was delivered,workspaceContents,id,,prod,informational,N:1
contentUsageHistory,workspaceContentVersionId,,The version id of the workspace content that was delivered,workspaceContentVersions,id,,prod,informational,N:1
contentUsageHistory,livesendLinkId,,The id of the livesend link that this document was included in,livesendLinks,id,,prod,informational,N:1
contentUsageHistory,livesendLinkContentId,,This is guaranteed unique in this table and can be treated as a primary key to join to and table that can be joined to livesendLinkContents,livesendLinkContents,id,,prod,primary,N:1
contentUsageHistory,generatedLivedocId,,,generatedLivedocs,id,,roadmap,informational,N:1
contentUsageHistory,searchClickId,,,searchClick,id,,roadmap,primary,N:1
contentUsageHistory,contentProfileId,,The id of the content profile this document was delivered from,contentProfiles,id,,prod,primary,N:1
contentUsageHistory,productArea,,,,,,roadmap,,
contentUsageHistory,application,,,,,,roadmap,,
contents,id,,"The id of the content which can globally identify content from library, workspace, or a generated livedoc",,,,roadmap,,
contents,instanceName,,The name of the document as given by the user or generated as part of the Livedoc generation,,,,roadmap,,
contents,normalizedName,,The normalized source content name.  This will be the library content name for all content that comes from the library and the workspace name for content directly uploaded to Workspace.,,,,roadmap,,
contents,libraryContentId,,The id of the library content.  This id is also present on all generated livedocs as well as any workspace content that originated from the library,libraryContents,id,,roadmap,informational,1:01
contents,latestLibraryContentVersionId,,The id of the latest version of the library content,,,,roadmap,,
contents,latestLibraryContentVersionCreatedAt,,The datetime that the latest version of the library content was created,,,,roadmap,,
contents,workspaceContentId,,The id of the workspace content,workspaceContents,id,,roadmap,informational,1:01
contents,latestworkspaceContentVersionId,,The id of the latest version of the workspace content,,,,roadmap,,
contents,latestWorkspaceContentVersionCreatedAt,,The datetime that the latest version of the workspace content was created,,,,roadmap,,
contents,publishedVersionId,,The libraryContentVersionId of the highest published version of the document,,,,tbd,,
contents,publishedVersionCreatedAt,,The datetime that the highest published version was created,,,,tbd,,
contents,publishedVersionExpiresAt,,The expiration date for the highest published version,,,,roadmap,,
contents,generatedLivedocId,,The id of the generated livedoc that is represented in this table,generatedLivedocs,id,,roadmap,informational,1:01
contents,createdAt,,"The datetime that the first version of this document was created relative to the document location (i.e. the createdAt for workspace content is when it was saved to workspace, not the date of the library content's creation)",,,,roadmap,,
contents,createdBy,,The id of the user who created the content,,,,roadmap,,
contents,modifiedAt,,The datetime that this document or its metadata was modified in any way,,,,roadmap,,
contents,deletedAt,,The datetime that this document was deleted,,,,roadmap,,
contents,teamsiteId,,The teamsite id of content.  This will exist for all content that has a libraryContentId.,teamsites,id,,roadmap,primary,N:1
contents,teamsiteName,,The teamsite name of content.  This will exist for all content that has a libraryContentId.,,,,roadmap,,
contents,version,,The library content version or workspace content version of the latest version of the content,,,,roadmap,,
contents,isDeleted,,A boolean indicating whether the content has been deleted,,,,roadmap,,
contents,isPublished,,A boolean indicating whether the content is currently published,,,,roadmap,,
contents,format,,The format of the content,,,,roadmap,,
contents,ownerId,,The id of the owner of the file in the library.  This is only present for content with a library content id (including generated livedocs and content in workspace).,users,id,,roadmap,primary,N:1
contents,ownerUsername,,The username of the owner of the file in the library.  This is only present for content with a library content id (including generated livedocs and content in workspace).,,,,roadmap,,
contents,totalPages,,The total number of pages of the latest version of the document,,,,tbd,,
contents,libraryUrl,,The url of the content in the Content Manager library,,,,roadmap,,
contents,workspaceUrl,,The url of the content in Workspace (what url do we want here?  Probably the share url?  Presumably we want to make sure this URL respects permissions?),,,,roadmap,,
contents,docCenterUrl,,The universal url of the content in DocCenter,,,,roadmap,,
contents,newsCenterUrl,,The universal url of the content in NewsCenter,,,,roadmap,,
contents,originContentProfileId,,The content profile id that the content originated from (this is present for all workspace content that has a libraryContentId),contentProfiles,id,,tbd,informational,N:1
contents,properties,,This is an object that contains all of the content properties for this document,,,,roadmap,,
contents,isContextualFolderContent,,A boolean indicating if this content is in a contextual workspace folder,,,,roadmap,,
contents,isFolder,,A boolean indicating if this content is a folder,,,,roadmap,,
contents,isCartContent,,A boolean indicating if this is content in a user's document cart (which is a specialzed hidden workspace folder),,,,roadmap,,
contents,materializedPath,,The GUID path to this document in workspace,,,,roadmap,,
contents,thumbnailImageId,,An id to the lower resolution thumbnail image representing the latest version of this content,,,,roadmap,,
contents,previewImageId,,An id to the higher resolution preview image representing the latest version of this content,,,,roadmap,,
