table_name,field_name,field_type,description,mapped_from_table,mapped_from_field,mapping_type,release_date,relationship_category,cardinality
contentProfiles,id,,,,,,opdb,,
contentProfiles,name,,,,,,opdb,,
contentProfiles,isPublished,,,,,,opdb,,
contentProfiles,type,,,,,,opdb,,
contentProfiles,isPredictiveOnly,,,,,,opdb,,
contentProfiles,teamsiteId,,,,,,opdb,,
contentProfiles,modifiedAt,,,,,,opdb,,
contentProperties,id,,,,,,opdb,,
contentProperties,name,,,,,,opdb,,
contentProperties,type,,,,,,opdb,,
contentProperties,teamsiteId,,,,,,opdb,,
contentProperties,isRequired,bool,,,,,opdb,,
contentPropertyAssignments,libraryContentId,,,libraryContents,id,,opdb,primary,N:1
contentPropertyAssignments,contentPropertyId,,,contentProperties,id,,opdb,primary,N:1
contentPropertyAssignments,contentPropertyName,,,,,,opdb,,
contentPropertyAssignments,contentPropertyType,,,,,,opdb,,
contentPropertyAssignments,contentPropertyValue,,,,,,opdb,,
contentPropertyValues,value,,,,,,notpossible,,
contentPropertyValues,contentPropertyId,,,contentProperties,id,,notpossible,primary,N:1
contentPropertyValues,contentPropertyName,,,,,,notpossible,,
contentPropertyValues,contentPropertyType,,,,,,notpossible,,
contentViewHistory,id,,The primary id for events in this table,,,,prod,,
contentViewHistory,action,,"The type of view action taken, currently always set to 'view' but may have additional view actions in the future",,,,prod,,
contentViewHistory,occurredAt,,The datetime when the event occurred,,,,prod,,
contentViewHistory,userId,,The id of the user who performed the action,users,id,,prod,primary,N:1
contentViewHistory,userUsername,,The username of the user who performed the action,,,,roadmap,,
contentViewHistory,instanceName,,"The name given to the document before it was delivered.  Typically this is the name of the library content, except in cases of Livedocs with generated names or documents renamed in Workspace or cart before being delivered",,,,roadmap,,
contentViewHistory,instanceFormat,,"The format of the viewed content (pptx, docx, pdf, etc.)",,,,roadmap,,
contentViewHistory,libraryContentId,,The id of the library content that was viewed even if the view was on a derived Workspace document,libraryContents,id,,prod,informational,N:1
contentViewHistory,libraryContentVersionId,,The version id of the library content that was viewed even if the view was on a derived Workspace document,libraryContentVersions,id,,prod,informational,N:1
contentViewHistory,workspaceContentId,,The id of the workspace content that was viewed,workspaceContents,id,,prod,informational,N:1
contentViewHistory,workspaceContentVersionId,,The version id of the workspace content that was viewed,workspaceContentVersions,id,,prod,informational,N:1
contentViewHistory,contentId,,The global content id of the content being viewed,contents,id,,roadmap,primary,N:1
contentViewHistory,searchClickId,,,searchClick,id,,roadmap,,N:1
contentViewHistory,contentProfileId,,The id of the content profile this document was viewed from,contentProfiles,id,,prod,informational,N:1
contentViewHistory,productArea,,,,,,roadmap,,
contentViewHistory,application,,,,,,roadmap,,
emailRecipients,emailId,,,emails,id,,tbd,primary,N:1
emailRecipients,externalUserEmail,,,,,,tbd,,
emailRecipients,externalUserId,,,externalUsers,id,,tbd,primary,N:1
emails,id,,The primary id for items in this table,,,,tbd,,
emails,createdBy,,,users,id,,tbd,primary,N:1
emails,createdAt,,,,,,tbd,,
emails,subject,,,,,,tbd,,
emails,body,,,,,,tbd,,
externalUsers,id,,The primary id for items in this table,,,,roadmap,,
externalUsers,email,,,,,,roadmap,,
externalUsers,emailDomain,,,,,,roadmap,,
externalUsers,trackingOptOut,,,,,,roadmap,,
externalUsers,emailOptOut,,,,,,roadmap,,
generatedLivedocs,id,uniqueidentifier,The unique identifier for a given generated livedoc,contents,id,,staging,primary,1:01
generatedLivedocs,libraryContentId,,,libraryContents,id,,staging,informational,N:1
generatedLivedocs,libraryContentVersionId,uniqueidentifier,The libraryContentVersionId of the livedoc template,libraryContentVersions,id,,staging,informational,N:1
generatedLivedocs,processingTime,decimal,The time it took the engine to process the document,,,,internal,,
generatedLivedocs,thumbnailImageId,uniqueidentifier,An id to the lower resolution thumbnail image representing the generated livedoc,,,,roadmap,,
generatedLivedocs,previewImageId,uniqueidentifier,An id to the higher resolution preview image representing the generated livedoc,,,,roadmap,,
generatedLivedocs,userId,uniqueidentifier,The id of the user who generated the livedoc,users,id,,staging,,
generatedLivedocs,occurredAt,datetime2,The datetime the livedoc was generated,,,,staging,,
generatedLivedocSlides,id,uniqueidentifier,The unique identifier for a given slide in the generated livedoc,,,,staging,,
generatedLivedocSlides,generatedLivedocId,uniqueidentifier,The id of the generated livedoc that this slide was included in,generatedLivedocs,id,,staging,primary,N:1
generatedLivedocSlides,pageShortId,nvarchar(255),The global unique identifier for this slide,,,,staging,,
generatedLivedocSlides,title,nvarchar(max),The title of this slide,,,,staging,,
generatedLivedocSlides,position,integer,The 1-based position of this slide in the presentation,,,,staging,,
generatedLivedocSlides,thumbnailImageId,uniqueidentifier,the lower resolution thumbnail imageId of this slide which can be used to get a thumbnail image of the slide,,,,roadmap,,
generatedLivedocSlides,parentComponentId,uniqueidentifier,The component that this slide was in as part of this presentation,,,,staging,,
generatedLivedocData,id,uniqueidentifier,The primary id for items in this table,,,,staging,,
generatedLivedocData,generatedLivedocId,uniqueidentifier,The id of the generated livedoc that this data belongs to,generatedLivedocs,id,,staging,primary,N:1
generatedLivedocData,fieldName,nvarchar(max),The name of the field,,,,staging,,
generatedLivedocData,fieldValue,nvarchar(max),The value of the field,,,,staging,,
generatedLivedocData,fieldType,nvarchar(255),"The type of the field such as integer, string, float, date",,,,staging,,
generatedLivedocComponents,id,uniqueidentifier,The primary id for items in this table,,,,staging,,
generatedLivedocComponents,generatedLivedocId,uniqueidentifier,The id of the generated livedoc that this component was included in,generatedLivedocs,id,,staging,primary,N:1
generatedLivedocComponents,libraryContentId,uniqueidentifier,The libraryContentId of the component,,,,staging,,
generatedLivedocComponents,libraryContentVersionId,uniqueidentifier,The libraryContentVersionId of the component,,,,staging,,
generatedLivedocComponents,libraryContentShortId,uniqueidentifier,The short version of libraryContentId of the component (must have content id enabled in tenant),,,,staging,,
generatedLivedocComponents,thumbnailImageId,uniqueidentifier,the lower resolution thumbnail imageId of the library content which can be used to get a thumbnail image of the library content,,,,roadmap,,
generatedLivedocComponents,parentComponentId,uniqueidentifier,The id of the component that this component is a child of in this generated livedoc,,,,staging,,
generatedLivedocComponents,libraryContentName,nvarchar(max),The name of this component in the library,,,,staging,,
generatedLivedocComponents,type,nvarchar(255),"The type of component such as Slide, PDF, Chart, Table, or Image",,,,staging,,
generatedLivedocComponents,insertMethod,nvarchar(255),"The way this component was included in the presentation such as Shared, Reference, Dynamic, or External",,,,staging,,
generatedLivedocOutputs,id,uniqueidentifier,The primary id for items in this table,,,,staging,,
generatedLivedocOutputs,generatedLivedocId,uniqueidentifier,The id of the generated livedoc that this data belongs to,generatedLivedocs,id,,staging,,
generatedLivedocOutputs,format,nvarchar(255),"The format of the generated livedoc (pdf, pptx, docx, excel)",,,,staging,,
generatedLivedocOutputs,name,nvarchar(max),The display name for the generated livedoc (used when showing the generated livedoc in our product UI),,,,staging,,
generatedLivedocOutputs,filename,nvarchar(max),The file name of the generated livedoc that user can deliver,,,,staging,,
generatedLivedocOutputs,size,integer,The file size in bytes for the generated livedoc,,,,staging,,
generatedLivedocOutputs,imageDPI,integer,The image DPI settings of the generated livedoc,,,,staging,,
generatedLivedocOutputs,clearNotes,bool,Whether the document was generated with notes or notes cleared,,,,staging,,
generatedLivedocOutputs,outputLayout,nvarchar(max),The PDF output layout of Full Page Slides or Note Pages,,,,staging,,
generatedLivedocOutputs,compatibility,nvarchar(max),The Acrobat version the PDF is designed for,,,,staging,,
generatedLivedocOutputs,hasOpenPassword,bool,Boolean indicating if the PDF requires a password to open,,,,staging,,
generatedLivedocOutputs,hasOwnerPassword,bool,Boolean indicating if the PDF has a password to allow modifications,,,,staging,,
generatedLivedocOutputs,hasOwnerOptions,bool,Boolean indicating if the PDF is set to limit the options the owner can change on the unlocked PDF,,,,staging,,
groupMembers,groupId,,,groups,id,,opdb,,
groupMembers,groupName,,,,,,opdb,,
groupMembers,userId,,,users,id,,opdb,,
groups,id,,The primary id for items in this table,,,,opdb,,
groups,name,,,,,,opdb,,
libraryContents,id,,The unique indentifier for a given document in the ControlCenter/ContentManager library,contents,id,,prod,primary,1:01
libraryContents,name,,The name of the document in the ControlCenter/ContentManager library,,,,prod,,
libraryContents,version,,The version number of the latest version of the document such as 5.3,,,,prod,,
libraryContents,createdAt,,The datetime that this document was created,,,,prod,,
libraryContents,modifiedAt,,The datetime that this document had any form of modification.  This is typically only used by machines and is not relevant for a person's perception of the last change to the document.,,,,prod,,
libraryContents,latestLibraryContentVersionId,,The libraryContentVersionId for the latest version of this document,libraryContentVersions,id,,prod,informational,1:01
libraryContents,latestLibraryContentVersionSize,,The size in bytes for the latest version of this document,,,,prod,,
libraryContents,latestLibraryContentVersionCreatedAt,,"The creation date for the latest version of this document, this is what most people think of when they ask 'when was this last updated'",,,,prod,,
libraryContents,libraryUrl,,The URL to this document in the library,,,,prod,,
libraryContents,newsCenterUrl,,The URL to this document in web NewsCenter,,,,prod,,
libraryContents,docCenterUrl,,The URL to this document in web DocCenter,,,,prod,,
libraryContents,format,,The format of this document,,,,prod,,
libraryContents,teamsiteId,,The id of the teamsite this document exists in,teamsites,id,,prod,primary,N:1
libraryContents,teamsiteName,,The name of the teamsite this document exists in,,,,roadmap,,
libraryContents,isDeleted,,Boolean indicating if this content is deleted,,,,prod,,
libraryContents,ownerId,,The id of the owner of this document,users,id,,prod,primary,N:1
libraryContents,ownerUsername,,The username of the owner of this document,,,,roadmap,,
libraryContents,isPublished,,Boolean indicating if any version of this document is published,,,,prod,,
libraryContents,assignedToProfiles,,A JSON object representing the list of profiles this document is assigned to,,,,prod,,
libraryContents,publishedVersionExpiresAt,,The expiration date of the latest published version,,,,prod,,
libraryContents,properties,,This is an object that contains all of the content properties for this document,,,,prod,,
libraryContents,thumbnailImageId,,An id to the lower resolution thumbnail image representing the latest version of the library content,,,,tbd,,
libraryContents,previewImageId,,An id to the higher resolution preview image representing the latest version of the library content,,,,tbd,,
libraryContentVersions,id,,The primary id for items in this table,,,,opdb,,
libraryContentVersions,name,,,,,,opdb,,
libraryContentVersions,libraryContentId,,,libraryContents,id,,opdb,primary,N:1
libraryContentVersions,createdBy,,,users,id,,opdb,primary,N:1
libraryContentVersions,size,,,,,,opdb,,
libraryContentVersions,createdAt,,,,,,opdb,,
libraryContentVersions,modifiedAt,,,,,,opdb,,
libraryContentVersions,version,,,,,,opdb,,
libraryContentVersions,assignedToProfiles,,,,,,opdb,,
libraryContentVersions,isPublished,,,,,,opdb,,
libraryContentVersions,isExpired,,,,,,opdb,,
libraryContentVersions,expiresAt,,,,,,opdb,,
libraryContentVersions,thumbnailImageId,,An id to the lower resolution thumbnail image for this library content version,,,,tbd,,
libraryContentVersions,previewImageId,,An id to the higher resolution preview image for this library content version,,,,tbd,,
livedocGenerationHistory,id,,The primary id for items in this table,,,,tbd,,
livedocGenerationHistory,generatedLivedocId,,,generatedLivedocs,id,,tbd,primary,1:01
livedocGenerationHistory,createdAt,,,,,,tbd,,
livedocGenerationHistory,createdBy,,,users,id,,tbd,primary,N:1
livedocGenerationHistory,libraryContentId,,,libraryContents,id,,tbd,informational,N:1
livedocGenerationHistory,libraryContentVersionId,,,libraryContentVersions,id,,tbd,informational,N:1
livedocGenerationHistory,workspaceContentId,,,workspaceContents,id,,tbd,informational,N:1
livedocGenerationHistory,workspaceContentVersionId,,,workspaceContentVersions,id,,tbd,informational,N:1
livedocGenerationHistory,contentProfileId,,,contentProfiles,id,,tbd,primary,N:1
livedocGenerationHistory,productArea,,,,,,tbd,,
livedocGenerationHistory,application,,,,,,tbd,,
livedocGenerationHistory,occurredAt,,,,,,tbd,,
livesendLinkContents,id,,The primary id for items in this table,,,,prod,,
livesendLinkContents,name,,The name of the document in the livesend link,,,,prod,,
livesendLinkContents,livesendLinkId,,The id of the livesend link that this content is included in,livesendLinks,id,,prod,primary,N:1
livesendLinkContents,totalPages,,The total number of pages in this document,,,,prod,,
livesendLinkContents,url,,The url to a specific document in a livesend link,,,,notpossible,,
livesendLinkContents,createdAt,,The datetime that the content was added to the livesend link,,,,prod,,
livesendLinkContents,createdBy,,The user id of the user who created the livesend link,,,,prod,,
livesendLinkContents,modifiedAt,,"The datetime that this content was modified, this is used purely for ETL purposes and is typically the same as the createdAt date",,,,prod,,
livesendLinkMembers,livesendLinkId,,The id of the livesend link that this content is included in,livesendLinks,id,,prod,primary,N:1
livesendLinkMembers,externalUserId,,The id of the external user in the externalUsers table,externalUsers,id,,roadmap,primary,N:1
livesendLinkMembers,internalUserId,,"The id of the user if a user with this email address was found in the users table.  In the case that more than one user was found, one of them will be chosen at random.",users,id,,tbd,primary,N:1
livesendLinkMembers,createdAt,,The datetime that the link member was added to the livesend link,,,,prod,,
livesendLinkMembers,modifiedAt,,"The datetime that this link member was modified, this is used purely for ETL purposes and is typically the same as the createdAt date",,,,prod,,
livesendLinkMembers,email,,The email address of the link member,,,,prod,,
livesendLinks,id,,The primary id for items in this table,,,,prod,,
livesendLinks,url,,The url of the livesend link,,,,roadmap,,
livesendLinks,isSeparateSend,,"A boolean indicating if the link was generated as the result of a ""blast email"" which creates many links or if the link is a shared link across many recipients",,,,prod,,
livesendLinks,trackingCode,,The tracking code entered by the user when generating the livesend link,,,,roadmap,,
livesendLinks,createdAt,,The datetime that the livesend link was created,,,,prod,,
livesendLinks,createdBy,,The user id of the user who created the livesend link,users,id,,prod,primary,N:1
livesendLinks,emailId,,The id of the email that this link was sent as a part of,emails,id,,roadmap,primary,N:1
livesendPageViews,livesendLinkContentId,,The id of the livesend link content that the page view occurred on,livesendLinkContents,id,,prod,primary,N:1
livesendPageViews,occurredAt,,The datetime that the page view occurred,,,,prod,,
livesendPageViews,sessionStartedAt,,The datetime that the viewing session started in the recipient's browser,,,,prod,,
livesendPageViews,sessionEndedAt,,The datetime that the viewing session ended in the recipient's browser,,,,prod,,
livesendPageViews,duration,,The number of milliseconds spent viewing the page until the next event occurs.,,,,prod,,
livesendPageViews,livesendViewingSessionId,,The id of the livesend viewing session that this page view is a part of,livesendViewingSession,id,,prod,primary,N:1
livesendPageViews,legacyLivesendContentId,,"[INTERNAL] This is the livesendContentId from the operational database, for reference only.",,,,internal,,
livesendPageViews,pageIndex,,The 1-N based page number that was viewed,,,,prod,,
livesendViewingSession,id,,The primary id for items in this table,,,,tbd,,
livesendViewingSession,livesendLinkId,,The id of the livesend link that this session is acting on,livesendLinks,id,,tbd,primary,N:1
livesendViewingSession,viewDetails,,[TBD] We may want some form of summary of the session?  Maybe as multiple fields not a JSON object.,,,,tbd,,
livesendViewingSession,sessionStartedAt,,The datetime that the viewing session started in the recipient's browser,,,,tbd,,
livesendViewingSession,sessionEndedAt,,The datetime that the viewing session ended in the recipient's browser,,,,tbd,,
searchClicks,id,,The primary id for events in this table,,,,roadmap,,
searchClicks,searchHistoryId,,The id of the search history that this click happened in,searchHistory,id,,roadmap,primary,N:1
searchClicks,clickNumber,,The number of the click in the searchHistoryId in cases where the user clicks on many documents within a single set of search results,,,,roadmap,,
searchClicks,viewMode,,"The view mode (list, card, or tile view) the user was in when they clicked on a document",,,,roadmap,,
searchClicks,currentPage,,The current page of the search when the click happened (pages numbered from 1),,,,roadmap,,
searchClicks,resultRank,,The index of the item in the result list relative to the first item on page 1 (results numbered from 1).  ,,,,roadmap,,
searchClicks,activeScope,,"Which scope (DocCenter, Workspace, ContentManager, or All) the user has active when they click on a document",,,,roadmap,,
searchFacets,searchHistoryId,,The id of the search history that this facet acted on,searchHistory,id,,roadmap,primary,N:1
searchFacets,contentPropertyId,,The id of the content property that this facet is based on,contentProperties,id,,roadmap,informational,N:1
searchFacets,contentPropertyName,,The name of the content property that this facet is based on,,,,roadmap,,
searchFacets,contentPropertyValue,,The value of the content property that this facet is applying,,,,roadmap,,
searchHistory,id,,"The primary id for events in this table.  Represents a change in search term or facets, but does not change across pages.",,,,prod,,
searchHistory,searchTermRaw,,The search term as entered by the user,,,,prod,,
searchHistory,searchTermNormalized,,The search term converted to lowercase and all special characters replaced by their ASCII equivalent,,,,prod,,
searchHistory,searchCycleId,,An id for the combined cycle of steps for search and filter,,,,prod,,
searchHistory,searchType,,Keyword Search or Facet Search,,,,prod,,
searchHistory,occurredAt,,The timestamp that the search occurred,,,,prod,,
searchHistory,userId,,The id of the user who performed the search,users,id,,prod,primary,N:1
searchHistory,resultCount,,The total number of results returned by the search,,,,prod,,
searchHistory,resultCountDocCenter,,The total number of DocCenter results returned by the search,,,,prod,,
searchHistory,resultCountNewsCenter,,The total number of NewsCenter results returned by the search,,,,prod,,
searchHistory,resultCountContentManager,,The total number of ContentManager results returned by the search,,,,prod,,
searchHistory,resultCountControlCenter,,The total number of ControlCenter results returned by the search,,,,prod,,
searchHistory,resultCountWorkspace,,The total number of Workspace results returned by the search,,,,prod,,
searchHistory,selectedFacets,,A JSON object representing key value pairs of properties and selected values,,,,prod,,
searchHistory,sortBy,,"What the search is sorted by, Relevance or Last Modified",,,,prod,,
searchHistory,application,,The application where the search was performed,,,,tbd,,
searchHistory,duration,,[INTERNAL ONLY] Duration in milliseconds it took for the search to return results,,,,internal,,
searchHistory,scope,,"A JSON object represting the product area and folder scope of the search such as {""productArea"" : [""DocCenter""], ""folder"" : {""path"" : ""/profile/folder name/"", ""id"" : ""folder Id""}}",,,,tbd,,
searchWords,searchHistoryId,,The id of the search history these words are from,searchHistory,id,,roadmap,primary,N:1
searchWords,word,,A single word from the search term,,,,roadmap,,
searchWords,searchCycleId,,An id for the combined cycle of steps for search and filter,,,,roadmap,,
searchWords,occurredAt,,The timestamp that the search occurred,,,,roadmap,,
teamsites,id,,The primary id for items in this table,,,,opdb,,
teamsites,name,,The name of the teamsite,,,,opdb,,
userLoginHistory,id,,The primary id for items in this table,,,,opdb,,
userLoginHistory,occurredAt,,The datetime that this login occurred,,,,opdb,,
userLoginHistory,userId,,The id of the user who logged in,users,id,,opdb,primary,N:1
userLoginHistory,application,,The application the user was using when they logged in,,,,opdb-dirty,,
userProperties,id,,The primary id for items in this table,,,,opdb,,
userProperties,name,,The name of the user property,,,,opdb,,
userProperties,type,,"The type of the user property (string, integer, date, boolean, float)",,,,opdb,,
userPropertyAssignments,userId,,The id of the user that this property applies to,users,id,,opdb,primary,N:1
userPropertyAssignments,userPropertyId,,The id of the user property,userProperties,id,,opdb,primary,N:1
userPropertyAssignments,userPropertyName,,The name of the user property,,,,opdb,,
userPropertyAssignments,userPropertyType,,"The type of the user property (string, integer, date, boolean, float)",,,,opdb,,
userPropertyAssignments,userPropertyValue,,One of the values assigned to the given user for this user property,,,,opdb,,
userPropertyValues,value,,The list of values for a given user property,,,,notpossible,,
userPropertyValues,userPropertyId,,The id of the user property that this value belongs to,userProperties,id,,notpossible,primary,N:1
userPropertyValues,userPropertyName,,The name of the user property that this value belongs to,,,,notpossible,,
userPropertyValues,userPropertyType,,The type of the user property that this value belongs to,,,,notpossible,,
users,id,,The primary id for items in this table,,,,prod,,
users,ssoUserId,,The single sign-on id for the user,,,,opdb,,
users,username,,The user's username,,,,prod,,
users,email,,The user's email address,,,,prod,,
users,emailDomain,,The user's email address domain such as seismic.com,,,,prod,,
users,fullName,,The user's full name,,,,prod,,
users,firstName,,The user's first name or given name,,,,prod,,
users,lastName,,The user's last name or surname,,,,prod,,
users,createdAt,,The timestamp when the user record was created,,,,prod,,
users,modifiedAt,,The timestamp when the user record was last modified,,,,prod,,
users,deletedAt,,The timestamp when the user record was marked deleted,,,,prod,,
users,organization,,The user's organization,,,,prod,,
users,title,,The user's title,,,,prod,,
users,isDeleted,,A flag indicating if the user is currently considered deleted,,,,prod,,
users,licenseType,,"The license type for the user such as premium, business, or partner",,,,prod,,
users,isSeismicEmployee,,A flag indicating if the user is a Seismic employee,,,,prod,,
users,isSystemAdmin,,A flag indicating if the user has system administration permissions,,,,opdb-difficult,,
users,defaultContentProfileId,,The id of the users default content profile,,,,prod,,
users,defaultContentProfileName,,The name of the users default content profile,,,,tbd - materialize,,
users,groups,,The list of groups the user is a member of,,,,prod,,
users,properties,,The list of properties and values for the user,,,,prod,,
workspaceComments,id,,The primary id for items in this table,,,,opdb,,
workspaceComments,commentText,,The plain text version of the comment,,,,opdb,,
workspaceComments,commentHTML,,The full HTML of the comment including styling and mentions,,,,opdb,,
workspaceComments,createdBy,,The user id of the user who made the comment,users,id,,opdb,primary,N:1
workspaceComments,workspaceContentId,,The workspace content id of the content that the comment was made on,workspaceContents,id,,opdb,,
workspaceComments,workspaceContentVersionId,,The workspace content version id of the content that the comment was made on,workspaceContentVersions,id,,opdb,,
workspaceComments,pageIndex,,The 1-N based page number where the annotation was placed,,,,opdb,,
workspaceComments,annotationType,,"The type of annotation (rectange, oval, pin, line) the comment is associated with",,,,opdb,,
workspaceContents,id,,The primary id for items in this table,contents,id,,prod,primary,1:01
workspaceContents,name,,The name of the content,,,,prod,,
