table_name,field_name,field_type,description,mapped_from_table,mapped_from_field,mapping_type,release_date,relationship_category,cardinality
workspaceContents,createdBy,,The user id of the user who created the first version of this content in workspace,users,id,,prod,primary,N:1
workspaceContents,createdAt,,The datetime that the first version of this content was created in Workspace,,,,prod,,
workspaceContents,modifiedAt,,The datetime that this content was last altered in any way,,,,prod,,
workspaceContents,isDeleted,,A boolean indicating if this content has been deleted from Workspace,,,,prod,,
workspaceContents,latestWorkspaceContentVersionId,,The workspace version id of the highest version,workspaceContentVersions,id,,prod,informational,1:01
workspaceContents,latestWorkspaceContentVersionCreatedAt,,The datetime that the highest version was created,,,,prod,,
workspaceContents,isContextualFolderContent,,A boolean indicating if this content is in a contextual workspace folder,,,,prod,,
workspaceContents,isFolder,,A boolean indicating if this content is a folder,,,,prod,,
workspaceContents,isCartContent,,A boolean indicating if this is content in a user's document cart (which is a specialzed hidden workspace folder),,,,prod,,
workspaceContents,libraryContentId,,The library content id that this workspace content originated from,libraryContents,id,,prod,informational,N:1
workspaceContents,version,,The current version number of this document in workspace,,,,prod,,
workspaceContents,materializedPath,,The GUID path to this document in workspace,,,,prod,,
workspaceContents,thumbnailImageId,,An id to the lower resolution thumbnail image representing the latest version of the workspace content,,,,tbd,,
workspaceContents,previewImageId,,An id to the higher resolution preview image representing the latest version of the workspace content,,,,tbd,,
workspaceContentVersions,id,,The primary id for items in this table,,,,opdb,,
workspaceContentVersions,workspaceContentId,,,workspaceContents,id,,opdb,primary,N:1
workspaceContentVersions,name,,,,,,opdb,,
workspaceContentVersions,isContextualFolderContent,,,,,,opdb,,
workspaceContentVersions,isLiveSendStorage,,,,,,internal,,
workspaceContentVersions,isFolder,,,,,,opdb,,
workspaceContentVersions,isCartContent,,,,,,opdb,,
workspaceContentVersions,isVirtualSharingNode,,,,,,internal,,
workspaceContentVersions,internalTypeCode,,,,,,internal,,
workspaceContentVersions,versionCreationMethod,,,,,,opdb,,
workspaceContentVersions,libraryContentId,,,libraryContents,id,,opdb-dirty,informational,N:1
workspaceContentVersions,libraryContentVersionId,,,libraryContentVersions,id,,opdb-dirty,informational,N:1
workspaceContentVersions,createdAt,,,,,,opdb,,
workspaceContentVersions,createdBy,,,users,id,,opdb,primary,N:1
workspaceContentVersions,version,,,,,,opdb,,
workspaceContentVersions,format,,,,,,opdb,,
workspaceContentVersions,size,,,,,,opdb,,
workspaceContentVersions,materializedPath,,,,,,opdb,,
workspaceContentVersions,thumbnailImageId,,An id to the lower resolution thumbnail image for this workspace content version,,,,opdb,,
workspaceContentVersions,previewImageId,,An id to the higher resolution preview image for this workspace content version,,,,opdb,,
meetings,id,uniqueidentifier,The id of the meeting,,,,tbd,,
meetings,url,nvarchar(max),The url of the meeting,,,,tbd,,
meetings,roomId,nvarchar(255),An id representing the persistent room available at the meeting's URL,,,,tbd,,
meetings,createdBy,uniqueidentifier,The user id of the user who created the meeting,,,,tbd,,
meetings,startedAt,datetime2,The timestamp when the meeting started,,,,tbd,,
meetings,endedAt,datetime2,The timestamp when the meeting ended,,,,tbd,,
meetings,screenShareDuration,bigint,Total screen share duration from all participants in seconds,,,,tbd,,
meetings,meetingDuration,bigint,Total meeting duration in seconds,,,,tbd,,
meetings,totalMembers,integer,Total number of members that attended the meeting,,,,tbd,,
meetingMembers,id,uniqueidentifier,The id of the meeting member,,,,tbd,,
meetingMembers,meetingId,uniqueidentifier,The id of the meeting this member participated in,meetings,id,,tbd,primary,N:1
meetingMembers,isModerator,bool,Boolean indicating if this member is the moderator of the meeting,,,,tbd,,
meetingMembers,screenShareDuration,bigint,Total screen share duration from this member in seconds,,,,tbd,,
meetingMembers,internalUserId,uniqueidentifier,The user id of the member if they are a registered user of the seimic platform,users,id,,tbd,primary,N:1
meetingMembers,internalUserEmail,nvarchar(max),The email address of the internal user,,,,tbd,,
meetingMembers,internalUserUsername,nvarchar(max),The username of the internal user,,,,tbd,,
meetingMembers,joinedAt,datetime2,The timestamp when the member first joined the meeting,,,,tbd,,
meetingMembers,exitedAt,datetime2,The timestamp when the member last exited the meeting,,,,tbd,,
meetingMembers,totalDuration,bigint,The total duration in seconds that the member was in the meeting,,,,tbd,,
meetingMembers,surveyRating,integer,The 1 to 5 rating provided by the member,,,,tbd,,
meetingMembers,surveyFeedback,nvarchar(max),The plain text feedback on the meeting from the member,,,,tbd,,
crmAccounts,crmOrganizationId,uniqueidentifier,The id of the crmOrganization that the account belongs to.,crmOrganizations,id,,staging,primary,N:1
crmAccounts,description,nvarchar(max),The description of the account as specified in the external system.,,,,staging,,
crmAccounts,domain,nvarchar(253),The domain to which the majority of the account's contact's email addresses belong.,,,,staging,,
crmAccounts,externalSystemCreatedAt,datetime2,The date and time the account was created according to the external system.,,,,staging,,
crmAccounts,externalSystemId,nvarchar(128),The id of the account according to the external system.,,,,staging,,
crmAccounts,externalSystemOwnerId,nvarchar(128),The id of the user that is the owner of the account according to the external system.,,,,staging,,
crmAccounts,externalSystemModifiedAt,datetime2,The date and time the account was last updated according to the external system.,,,,staging,,
crmAccounts,id,uniqueidentifier,The unique identifier for the account.,,,,staging,,
crmAccounts,industry,nvarchar(256),The industry of the account as specified in the external system.,,,,staging,,
crmAccounts,industryNormalized,nvarchar(128),"The best available, normalized industry that the account belongs to.",,,,staging,,
crmAccounts,industryNormalizedCustomer,nvarchar(128),The normalized industry that the account belongs to based on the customer's industry selection.,,,,staging,,
crmAccounts,name,nvarchar(256),The name of the account as specified in the external system.,,,,staging,,
crmAccounts,ownerCrmUserId,uniqueidentifier,The id of the crmUser that is designated as the owner of the account.,crmUsers,id,,staging,primary,N:1
crmAccounts,type,nvarchar(256),The type of the account as specified in the external system.,,,,staging,,
crmAccounts,modifiedAt,datetime2,The date and time the crmAccount record was last updated.,,,,staging,,
crmContacts,businessFunction,nvarchar(64),The business function of the contact as specified in the external system.,,,,staging,,
crmContacts,company,nvarchar(256),The company of the contact as specified in the external system.,,,,staging,,
crmContacts,crmAccountId,uniqueidentifier,The id of the crmAccount that the contact is associated with.,crmAccounts,id,,staging,primary,N:1
crmContacts,crmOrganizationId,uniqueidentifier,The id of the crmOrganization that the contact is associated with.,crmOrganizations,id,,staging,primary,N:1
crmContacts,department,nvarchar(128),The department of the contact as specified in the external system.,,,,staging,,
crmContacts,description,nvarchar(max),The description of the contact as specified in the external system.,,,,staging,,
crmContacts,email,nvarchar(254),The email address of the contact as specified in the external system.,,,,staging,,
crmContacts,externalSystemAccountId,nvarchar(128),The id in the external system of the account the contact is associated with.,,,,staging,,
crmContacts,externalSystemCreatedAt,datetime2,The date and time the contact was created according to the external system.,,,,staging,,
crmContacts,externalSystemId,nvarchar(128),The id of the contact according to the external system.,,,,staging,,
crmContacts,externalSystemModifiedAt,datetime2,The date and time that the contact was last updated according to the external system.,,,,staging,,
crmContacts,firstName,nvarchar(128),The first name of the contact as specified in the external system.,,,,staging,,
crmContacts,id,uniqueidentifier,The unique identifier for the contact.,,,,staging,,
crmContacts,industry,nvarchar(256),The industry of the contact as specified in the external system.,,,,staging,,
crmContacts,industryNormalized,nvarchar(128),"The best available, normalized industry that the contact belongs to.",,,,staging,,
crmContacts,industryNormalizedCustomer,nvarchar(128),The normalized industry that the contact belongs to based on the industry selection in the external system.,,,,staging,,
crmContacts,isInternal,bit,Indicates whether the contact is internal to the organization or not.,,,,staging,,
crmContacts,lastName,nvarchar(128),The last name of the contact as specified in the external system.,,,,staging,,
crmContacts,name,nvarchar(256),The full name of the contact as specified in the external system.,,,,staging,,
crmContacts,title,nvarchar(256),The title of the contact as specified in the external system.,,,,staging,,
crmContacts,modifiedAt,datetime2,The date and time the the crmContact was last updated.,,,,staging,,
crmContentUsageHistoryMappings,contentUsageHistoryId,uniqueidentifier,The id of the contentUsageHistory record that the given crm context maps to.,contentUsageHistory,id,,staging,primary,N:1
crmContentUsageHistoryMappings,crmContactId,uniqueidentifier,The id of the crmContact record that the contentUsageHistory record maps to.,crmContacts,id,,staging,primary,N:1
crmContentUsageHistoryMappings,crmOrganizationId,uniqueidentifier,The id of the crmOrganization record that the contentUsageHistory record maps to.,crmOrganizations,id,,staging,primary,N:1
crmContentUsageHistoryMappings,crmLeadId,uniqueidentifier,The id of the crmLead record that the contentUsageHistory record maps to.,crmLeads,id,,staging,primary,N:1
crmContentUsageHistoryMappings,crmSalesTimelinePeriodId,uniqueidentifier,The id of the crmSalesTimelinePeriod that the contentUsageHistory record maps to.,crmSalesTimelinePeriods,id,,staging,primary,N:1
crmContentUsageHistoryMappings,id,uniqueidentifier,The unique identifier for the crmContentUsageHistoryMapping record.,,,,staging,,
crmContentUsageHistoryMappings,modifiedAt,datetime2,The date and time that the crmContentUsageHistoryMapping was last updated.,,,,staging,,
crmLeads,businessFunction,nvarchar(64),The business function of the lead as specified in the external system.,,,,staging,,
crmLeads,company,nvarchar(256),The company of the lead as specified in the external system.,,,,staging,,
crmLeads,convertedCrmAccountId,uniqueidentifier,The id of the crmAccount that the lead converted to.,,,,staging,,
crmLeads,convertedCrmContactId,uniqueidentifier,the id of the crmContact that the lead converted to.,,,,staging,,
crmLeads,convertedCrmOpportunityId,uniqueidentifier,The id of the crmOpportunity that the lead converted to.,,,,staging,,
crmLeads,crmOrganizationId,uniqueidentifier,The id of the crmOrganization that the lead belongs to.,,,,staging,,
crmLeads,department,nvarchar(128),The department of the lead as specified in the external system.,,,,staging,,
crmLeads,description,nvarchar(max),The description of the lead as specified in the external system.,,,,staging,,
crmLeads,email,nvarchar(254),The email address of the lead as specified in the external system.,,,,staging,,
crmLeads,externalSystemConvertedAccountId,nvarchar(128),The id of the account that the lead converted to according to the external system.,,,,staging,,
crmLeads,externalSystemConvertedContactId,nvarchar(128),The id of the contact that the lead converted to according to the external system.,,,,staging,,
crmLeads,externalSystemConvertedAt,datetime2,The date and time that the lead converted according to the external system.,,,,staging,,
crmLeads,externalSystemConvertedOpportunityId,nvarchar(128),The id of the opportunity that the lead converted to according to the external system.,,,,staging,,
crmLeads,externalSystemCreatedAt,datetime2,The date and time that the lead was created according to the external system.,,,,staging,,
crmLeads,externalSystemId,nvarchar(128),The id of the lead record according to the external system.,,,,staging,,
crmLeads,externalSystemModifiedAt,datetime2,The date and time that the lead was updated according to the external system.,,,,staging,,
crmLeads,firstName,nvarchar(128),The first name of the lead as specified in the external system.,,,,staging,,
crmLeads,id,uniqueidentifier,The unique identifier of the crmLead record.,,,,staging,,
crmLeads,industry,nvarchar(256),The industry of the lead as specified in the external system.,,,,staging,,
crmLeads,industryNormalized,nvarchar(128),"The best available, normalized industry that the lead belongs to.",,,,staging,,
crmLeads,industryNormalizedCustomer,nvarchar(128),The normalized industry that the lead belongs to based on the industry selection in the external system.,,,,staging,,
crmLeads,isInternal,bit,Indicates whether the lead is internal to the organization or not.,,,,staging,,
crmLeads,lastName,nvarchar(128),The last name of the lead as specified in the external system.,,,,staging,,
crmLeads,name,nvarchar(256),The full name of the lead as specified in the external system.,,,,staging,,
crmLeads,title,nvarchar(256),The title of the lead as specified in the external system.,,,,staging,,
crmLeads,modifiedAt,datetime2,The date and time the the crmLead was last updated.,,,,staging,,
crmOpportunities,amount,"decimal(19,4)",The projected value of the opportunity in USD.,,,,staging,,
crmOpportunities,amountRaw,"decimal(19,4)",The projected value of the opportunity in the currency specified by currencyCode as specified in the external system.,,,,staging,,
crmOpportunities,crmAccountId,uniqueidentifier,The id of the crmAccount that the opportunity is associated with.,crmAccounts,id,,staging,primary,N:1
crmOpportunities,crmOrganizationId,uniqueidentifier,The id of the crmOrganization that the opportunity is associated with.,crmOrganizations,id,,staging,primary,N:1
crmOpportunities,currencyCode,nvarchar(3),The ISO currency code of the currency that amountRaw is given in as specified in the external system.,,,,staging,,
crmOpportunities,currentCrmStageId,nvarchar(64),The name of the crmStage that the opportunity is currently in.,crmStages,id,,staging,primary,N:1
crmOpportunities,currentCrmStageName,nvarchar(64),The name of the crmStage that the opportunity is currently in.,,,,staging,,
crmOpportunities,status,nvarchar(64),"Indicates the current state of the opportunity being active, won, or lost.",,,,staging,,
crmOpportunities,description,nvarchar(max),The description of the opportunity as specified in the external system.,,,,staging,,
crmOpportunities,externalSystemAccountId,nvarchar(128),The id of the account that the opportunity is associated with in the external system.,,,,staging,,
crmOpportunities,externalSystemClosedAt,datetime2,The close date of the opportunity as specified in the external system.,,,,staging,,
crmOpportunities,externalSystemCreatedAt,datetime2,The created date of the opportunity as specified in the external system.,,,,staging,,
crmOpportunities,externalSystemId,nvarchar(128),The id of the opportunity in the external system.,,,,staging,,
crmOpportunities,externalSystemOwnerId,nvarchar(128),The id of the user that is the owner of the opportunity according to the external system.,,,,staging,,
crmOpportunities,externalSystemModifiedAt,datetime2,The date and time that the opportunity was last updated according to the external system.,,,,staging,,
crmOpportunities,id,uniqueidentifier,The unique identifier of the crmOpportunity record.,,,,staging,,
crmOpportunities,name,nvarchar(256),The name of the opportunity as specified in the external system.,,,,staging,,
crmOpportunities,ownerCrmUserId,uniqueidentifier,The id of the crmUser that is designated as the owner of the opportunity.,crmUsers,id,,staging,primary,N:1
crmOpportunities,type,nvarchar(256),The type of the opportunity as specified in the external system.,,,,staging,,
crmOpportunities,modifiedAt,datetime2,The date and time that the crmOpportunity record was last updated.,,,,staging,,
crmOpportunityContacts,crmContactId,uniqueidentifier,The id of the crmContact record that is associated with the crmOpportunity specified by crmOpportunityId.,crmContacts,id,,staging,primary,N:1
crmOpportunityContacts,crmOpportunityId,uniqueidentifier,the id of the crmOpportunity record that is associated with the crmContact specified by crmContactId.,crmOpportunities,id,,staging,primary,N:1
crmOpportunityContacts,crmOrganizationId,uniqueidentifier,The id of the crmOrganization that the specified crmOpportunity and crmContact belong to.,crmOrganizations,id,,staging,primary,N:1
crmOpportunityContacts,externalSystemContactId,nvarchar(128),The id of the contact according to the external system.,,,,staging,,
crmOpportunityContacts,externalSystemCreatedAt,datetime2,The created date of the opportunity contact according to the external system.,,,,staging,,
crmOpportunityContacts,externalSystemId,nvarchar(128),The id of the opportunity contact in the external system.,,,,staging,,
crmOpportunityContacts,externalSystemOpportunityId,nvarchar(128),The id of the opportunity according to the external system.,,,,staging,,
crmOpportunityContacts,externalSystemModifiedAt,datetime2,The date and time that the record that represents the opportunity contact was updated according to the external system.,,,,staging,,
crmOpportunityContacts,id,uniqueidentifier,The unique identifier of the crmOpportunityContact record.,,,,staging,,
crmOpportunityContacts,isPrimary,bit,Boolean flag indicating whether the specified contact is the primary contact for the specified opportunity.,,,,staging,,
crmOpportunityContacts,role,nvarchar(48),The role of the specified contact for the specified opportunity as specified in the external system.,,,,staging,,
crmOpportunityContacts,modifiedAt,datetime2,The date and time that the crmOpportunityContact record was last updated.,,,,staging,,
crmOrganizations,externalSystemCreatedAt,datetime2,The created date of the organization according to the external system.,,,,staging,,
crmOrganizations,externalSystemId,nvarchar(128),The id of the organization in the external system.,,,,staging,,
crmOrganizations,externalSystemModifiedAt,datetime2,The date and time the organization was last updated according to the external system.,,,,staging,,
crmOrganizations,id,uniqueidentifier,The unique identifier of the crmOrganization record.,,,,staging,,
crmOrganizations,name,nvarchar(256),The name of the organization as specified in the external system.,,,,staging,,
crmOrganizations,modifiedAt,datetime2,The date and time the crmOrganization record was last updated.,,,,staging,,
crmSalesTimelinePeriods,closes,bit,Boolean flag indicating whether the related opportunity closed during the sales timeline period.,,,,staging,,
crmSalesTimelinePeriods,converts,bit,Boolean flag indicating whether the related lead converts during the sales timeline period.,,,,staging,,
crmSalesTimelinePeriods,crmLeadId,uniqueidentifier,The id of the crmLead record that the salesTimelinePeriod is associated with.,crmLeads,id,,staging,primary,N:1
crmSalesTimelinePeriods,crmOpportunityId,uniqueidentifier,The id of the crmOpportunity record that the salesTimelinePeriod is associated with.,crmOpportunities,id,,staging,primary,N:1
crmSalesTimelinePeriods,crmOrganizationId,uniqueidentifier,The id of the crmOrganization record that the salesTimelinePeriod is associated with.,crmOrganizations,id,,staging,primary,N:1
crmSalesTimelinePeriods,endTime,datetime2,The date and time that marks the end of the salesTimelinePeriod.,,,,staging,,
crmSalesTimelinePeriods,externalSystemLeadId,nvarchar(128),The id of the lead record according to the external system.,,,,staging,,
crmSalesTimelinePeriods,externalSystemOpportunityId,nvarchar(128),The id of the opportunity record according to the external system.,,,,staging,,
crmSalesTimelinePeriods,externalSystemType,nvarchar(256),The type of record in the external system that the salesTimelinePeriod relates to. Values include 'lead' and 'opportunity'.,,,,staging,,
crmSalesTimelinePeriods,id,uniqueidentifier,The unique identifier of the salesTimelinePeriod record.,,,,staging,,
crmSalesTimelinePeriods,crmStageName,nvarchar(64),The name of the stage that the salesTimelinePeriod represents.,,,,staging,,
crmSalesTimelinePeriods,crmStageId,nvarchar(64),The id of the stage that the salesTimelinePeriod represents.,crmStages,id,,staging,primary,N:1
crmSalesTimelinePeriods,nextCrmStageName,nvarchar(64),The name of the stage that the specified lead/opportunity moved to after the stage represented by the salesTimelinePeriod.,,,,staging,,
crmSalesTimelinePeriods,nextCrmStageId,nvarchar(64),The id of the stage that the specified lead/opportunity moved to after the stage represented by the salesTimelinePeriod.,crmStages,id,,staging,primary,N:1
crmSalesTimelinePeriods,progresses,bit,Boolean flag indicating whether the salesTimelinePeriod constitutes deal progres.,,,,staging,,
crmSalesTimelinePeriods,timelineId,uniqueidentifier,The id of the full timeline for the given combination of lead and opportunity spanning from lead through opportunity.,,,,staging,,
crmSalesTimelinePeriods,timelineSortOrder,int,The index of this timeline period in the overall sales timeline for the given combination of lead and opportunity.,,,,staging,,
crmSalesTimelinePeriods,startTime,datetime2,The date and time that marks the start of the salesTimelinePeriod.,,,,staging,,
crmSalesTimelinePeriods,modifiedAt,datetime2,The date and time that the crmSalesTimelinePeriod record was updated.,,,,staging,,
crmSalesTimelinePeriods,wins,bit,Boolean flag indicating whether the related opportunity is won during the salesTimelinePeriod.,,,,staging,,
crmSalesTimelinePeriods,winsEventually,bit,Boolean flag indicating whether the related opportunity eventually closes as a win.,,,,staging,,
crmStages,crmOrganizationId,uniqueidentifier,The id of the crmOrganization that the stage belongs to.,crmOrganizations,id,,staging,primary,N:1
crmStages,externalSystemId,nvarchar(128),The id of the stage according to the external system.,,,,staging,,
crmStages,externalSystemModifiedAt,datetime2,The date and time that the stage record was updated according to the external system.,,,,staging,,
crmStages,forecastCategory,nvarchar(64),The forecast category that the stage belongs to as specified in the external system.,,,,staging,,
crmStages,id,uniqueidentifier,The unique identifier of the crmStage record.,,,,staging,,
crmStages,name,nvarchar(128),The master label of the stage as specified in the external system.,,,,staging,,
crmStages,probability,"decimal(9,5)","The probability that an opportunity will be won given that it is in the stage, as specified in the external system.",,,,staging,,
crmStages,sortOrder,int,The sort order of the stage as specified in the external system.,,,,staging,,
crmStages,modifiedAt,datetime2,The date and time that the crmStage record was updated.,,,,staging,,
crmUsers,crmOrganizationId,uniqueidentifier,The id of the crmOrganization that the user belongs to.,crmOrganizations,id,,staging,primary,N:1
crmUsers,department,nvarchar(128),The department of the user as specified in the external system.,,,,staging,,
crmUsers,division,nvarchar(256),The division of the user as specified in the external system.,,,,staging,,
crmUsers,email,nvarchar(254),The email address of the user as specified in the external system.,,,,staging,,
crmUsers,externalSystemCreatedAt,datetime2,The created date of the user according to the external system.,,,,staging,,
crmUsers,externalSystemId,nvarchar(128),The id of the user according to the external system.,,,,staging,,
crmUsers,externalSystemManagerId,nvarchar(128),The id of the user that is the manager of the user according to the external system.,,,,staging,,
crmUsers,externalSystemModifiedAt,datetime2,The date and time that the user record was updated according to the external system.,,,,staging,,
crmUsers,firstName,nvarchar(128),The first name of the user as specified in the external system.,,,,staging,,
crmUsers,fullPhotoUrl,nvarchar(256),The URL of the full photo of the user as specified by the external system.,,,,staging,,
crmUsers,id,uniqueidentifier,The unique identifier of the crmUser record.,,,,staging,,
crmUsers,role,nvarchar(256),The role of the use as specified in the external system.,,,,staging,,
crmUsers,isActive,bit,A boolean flag indicating whether or not the user is active as specified by the external system.,,,,staging,,
crmUsers,lastName,nvarchar(128),The last name of the user as specified in the external system.,,,,staging,,
crmUsers,managerCrmUserId,uniqueidentifier,The id of the crmUser that is designated as the manger of the user.,crmUsers,id,,staging,primary,N:1
crmUsers,name,nvarchar(256),The name of the user as specified in the external system.,,,,staging,,
crmUsers,title,nvarchar(256),The title of the user as specifed in the external system.,,,,staging,,
crmUsers,modifiedAt,datetime2,The date and time that the crmUser record was updated.,,,,staging,,
userActivity,id,,The unique identifier for the user activity,,,,roadmap,,
